{
  "spec": "context-manifest/0.1",
  "manifest_hash": "sha256:a16f7452b2f40643181b6bf3086836b933f0b68fcc73af0f51fbf1cd23fc7bd1",
  "origin": "https://saltbox.example",
  "issued": "2026-10-14T18:02:40Z",
  "offers": [
    {
      "id": "x-cooked_and_rated",
      "provenance": "observed",
      "as_of": "2026-10-14T18:02:40Z",
      "value": [
        {
          "recipe": "Mushroom and leek pie",
          "cooked": "2026-10-04",
          "rating": 5,
          "times_cooked": 2
        },
        {
          "recipe": "Sweet potato katsu curry",
          "cooked": "2026-10-11",
          "rating": 3,
          "times_cooked": 1
        }
      ]
    }
  ]
}
